{
  "schema_version": 1,
  "country": "PH",
  "version": "2026.10.02-2",
  "last_verified": "2026-10-02",
  "names": {
    "ko": "필리핀",
    "en": "Philippines",
    "local": "Pilipinas"
  },
  "local_language": {
    "name_ko": "필리핀어(타갈로그어)",
    "tts_lang": "fil-PH"
  },
  "sources": [
    {
      "id": "mofa_ph",
      "name": "외교부 해외안전여행 · 필리핀",
      "url": "https://0404.go.kr/ntnSafetyInfo/252/detail"
    },
    {
      "id": "etravel_faq",
      "name": "필리핀 eTravel · 자주 묻는 질문",
      "url": "https://etravel.gov.ph/frequently-asked-questions"
    },
    {
      "id": "embassy_ph_entry",
      "name": "주필리핀 대한민국 대사관 · 입국·체류 점검 사항(2026-02-26)",
      "url": "https://overseas.mofa.go.kr/ph-ko/brd/m_27094/view.do?seq=1331456"
    },
    {
      "id": "embassy_ph_lost",
      "name": "주필리핀 대한민국 대사관 · 여권 분실 때 긴급여권",
      "url": "https://overseas.mofa.go.kr/ph-ko/brd/m_3630/view.do?seq=1341502"
    },
    {
      "id": "dot_ph_bring",
      "name": "필리핀 관광부 한국사무소 · 여행 준비물",
      "url": "https://philippinetourism.co.kr/travel/what-to-bring"
    },
    {
      "id": "dot_ph_fruits",
      "name": "필리핀 관광부 한국사무소 · 열대과일",
      "url": "https://philippinetourism.co.kr/phil-intro/tropical-fruits"
    },
    {
      "id": "apqa_plant",
      "name": "농림축산검역본부 휴대 식물 검역",
      "url": "https://www.apqa.go.kr/plant/imQua/plant_quar_wong_ex.jsp"
    },
    {
      "id": "grab_locations",
      "name": "Grab 서비스 국가",
      "url": "https://www.grab.com/sg/locations/"
    },
    {
      "id": "gmaps_play",
      "name": "Google Play · Google 지도",
      "url": "https://play.google.com/store/apps/details?id=com.google.android.apps.maps"
    }
  ],
  "requirements": [
    {
      "nationality": "KR",
      "purpose": "tourism",
      "visa": "not_required",
      "stay_limit_days": 30,
      "forms": [
        "PH_ETRAVEL"
      ],
      "summary_ko": "대한민국 일반 여권은 비자 없이 30일까지 머물 수 있어요(필리핀이 정한 무비자). 더 머물려면 필리핀에서 체류 연장을 받아야 해요. 도착하기 전 72시간 안에 eTravel에 등록해야 해요.",
      "source": "mofa_ph",
      "last_verified": "2026-10-02",
      "passport_validity": {
        "months": 6,
        "basis": "arrival",
        "source": "embassy_ph_entry",
        "last_verified": "2026-10-02"
      }
    }
  ],
  "forms": [
    {
      "id": "PH_ETRAVEL",
      "name_ko": "필리핀 입국 신고 (eTravel)",
      "name_en": "eTravel",
      "official_url": "https://etravel.gov.ph/",
      "fee_ko": "무료. 돈을 내라는 사이트는 가짜예요. 공식 사이트는 etravel.gov.ph 하나뿐이에요.",
      "window_ko": "도착하기 전 72시간(3일) 안에 등록해요. 받은 QR을 캡처하거나 인쇄해 두고, 비행기를 타기 전에 항공사 직원에게 보여 줘요.",
      "window_days_including_arrival": 3,
      "source": "etravel_faq",
      "last_verified": "2026-10-02"
    }
  ],
  "sections": [
    {
      "id": "entry",
      "title_ko": "들어갈 때",
      "body_ko": [
        "필리핀에 들어가는 날 여권 유효기간이 6개월 이상 남아 있어야 해요.",
        "15세 미만 자녀와 함께 가면 영문 가족관계증명서처럼 내 자녀임을 보여 주는 서류를 챙기세요.",
        "왕복 비행기 표 없이 가면 머무는 이유를 설명해야 할 수 있어요.",
        "30일보다 오래 머물려면 비자 연장을 받아야 해요."
      ],
      "source": "embassy_ph_entry",
      "last_verified": "2026-10-02"
    },
    {
      "id": "payment",
      "title_ko": "돈",
      "body_ko": [
        "돈 단위는 페소예요.",
        "5만 페소나 미화 1만 달러가 넘는 돈(현금·수표 등)을 가지고 들어가거나 나올 때는 필리핀 중앙은행(BSP)에 전체 금액을 신고해야 해요. 신고하지 않으면 넘는 돈을 빼앗기고 벌금을 낼 수 있어요.",
        "외환 신고서는 도착 전에 온라인(ideclar.customs.gov.ph)으로 내거나, 공항 세관에서 써서 내요.",
        "서비스를 받으면 팁을 주는 편이에요. 보통 50~100페소쯤이에요."
      ],
      "source": "mofa_ph",
      "last_verified": "2026-10-02"
    },
    {
      "id": "transport",
      "title_ko": "이동",
      "body_ko": [
        "마닐라 공항에서는 흰색 일반 택시보다 Grab, 노란색 택시, 선불 쿠폰 택시를 타세요.",
        "택시를 타면 차량 번호, 탄 곳, 가는 곳을 아는 사람에게 알려 주세요.",
        "지프니(여럿이 타는 작은 버스)는 강도 사건이 있어 되도록 타지 마세요.",
        "택시 운전사가 주는 사탕이나 음료는 받지 마세요. 약을 넣어 정신을 잃게 한 뒤 물건을 훔치는 범죄가 있어요."
      ],
      "source": "mofa_ph",
      "last_verified": "2026-10-02"
    },
    {
      "id": "safety",
      "title_ko": "안전 (외교부 여행경보)",
      "body_ko": [
        "보라카이섬, 보홀섬, 세부 막탄섬(라푸라푸시), 수빅시는 1단계(여행유의)예요.",
        "수도 마닐라를 비롯한 나머지 대부분 지역은 2단계(여행자제)예요. 시아르가오주, 다바오시, 카가얀데오로시, 라귄딩안 공항과 N9 도로 일부도 2단계예요.",
        "팔라완섬 남쪽 일부(아볼란·나라·케손보다 남쪽)와 민다나오섬 일부는 3단계(출국권고)예요. 가지 마세요.",
        "민다나오의 잠보앙가, 술루·바실란·타위타위 군도는 4단계(여행금지)예요. 가지 마세요.",
        "살인·납치·강도 같은 큰 범죄가 자주 일어나요. 늘 조심하세요.",
        "여행경보는 자주 바뀌어요. 떠나기 전에 외교부 해외안전여행에서 꼭 다시 확인하세요."
      ],
      "source": "mofa_ph",
      "last_verified": "2026-10-02"
    }
  ],
  "transport_apps": [
    {
      "name": "Grab",
      "package": "com.grabtaxi.passenger",
      "link_type": "open_and_copy",
      "source": "grab_locations"
    },
    {
      "name": "Google 지도",
      "package": "com.google.android.apps.maps",
      "link_type": "maps_url",
      "source": "gmaps_play"
    }
  ],
  "phrases": [
    {
      "id": "restroom",
      "ko": "화장실이 어디예요?",
      "en": "Where is the restroom?",
      "local": "Nasaan ang banyo?",
      "reviewed": false
    },
    {
      "id": "lost",
      "ko": "길을 잃었어요",
      "en": "I'm lost.",
      "local": "Naliligaw ako.",
      "reviewed": false
    },
    {
      "id": "hospital",
      "ko": "병원에 가야 해요",
      "en": "I need to go to a hospital.",
      "local": "Kailangan kong pumunta sa ospital.",
      "reviewed": false
    },
    {
      "id": "slowly",
      "ko": "천천히 말해 주세요",
      "en": "Please speak slowly.",
      "local": "Pakibagalan po ang pagsasalita.",
      "reviewed": false
    },
    {
      "id": "address",
      "ko": "이 주소로 가 주세요",
      "en": "Please take me to this address.",
      "local": "Pakihatid po ako sa address na ito.",
      "reviewed": false
    },
    {
      "id": "police",
      "ko": "경찰을 불러 주세요",
      "en": "Please call the police.",
      "local": "Pakitawag po ang pulis.",
      "reviewed": false
    },
    {
      "id": "help",
      "ko": "도와주세요",
      "en": "Help me, please.",
      "local": "Tulong!",
      "reviewed": false
    }
  ],
  "emergency": [
    {
      "id": "all",
      "label_ko": "경찰·구급차·불 (통합 번호)",
      "number": "911",
      "source": "mofa_ph",
      "last_verified": "2026-10-02"
    }
  ],
  "embassy": {
    "name_ko": "주필리핀 대한민국 대사관 (마닐라 타기그) — 세부에는 분관이 따로 있어요",
    "address": "122 Upper Mckinley Road, Mckinley Town Center, Fort Bonifacio, Taguig City, 1634 Philippines",
    "phone": "+63-2-8856-9210",
    "emergency_phone": "+63-917-817-5703",
    "source": "mofa_ph",
    "last_verified": "2026-10-02"
  },
  "procedures": [
    {
      "id": "passport_lost",
      "title_ko": "여권을 잃어버렸어요",
      "steps_ko": [
        "가까운 경찰서에 분실·도난 신고를 하고 확인서(Police Report)를 받아요. 경찰이 분실 진술서 공증(Affidavit of loss)을 달라고 하면 근처 공증 사무소나 변호사 사무실에서 만들어요.",
        "대한민국 대사관에 직접 가서 긴급여권을 신청해요(대신 신청할 수 없어요). 수수료는 2,400페소이고, 사진 1장을 챙겨요. 신청서와 분실 사유서는 대사관에 있어요.",
        "새 여권을 가지고 마닐라 이민국 본청에 가서 입국 도장을 받아야 해요. 경찰 확인서, 공증한 분실 진술서, 항공사에서 받은 탑승 확인서를 챙겨요. 이민국은 주말·공휴일에 쉬니 평일에 움직이세요."
      ],
      "source": "embassy_ph_lost",
      "last_verified": "2026-10-02"
    }
  ],
  "shopping": [
    {
      "id": "fresh_mango",
      "category": "food",
      "names": {
        "ko": "생망고 등 생과일",
        "en": "Fresh mango and other fresh fruit",
        "local": "Mangga"
      },
      "why_ko": "관광부가 3~6월 제철 과일로 소개해요. 한국에 가져올 수 없으니 현지에서 드세요.",
      "import_status": "prohibited",
      "import_note_ko": "망고는 검역본부가 밝힌 수입 금지 과일이에요. 걸리면 그 자리에서 폐기돼요.",
      "source": "dot_ph_fruits",
      "import_source": "apqa_plant",
      "last_verified": "2026-10-02"
    }
  ],
  "power": {
    "plug_ko": "곳에 따라 콘센트 모양이 달라요. 납작한 핀 2개(11자) 플러그만 맞는 곳도 있어요",
    "kr_plug_fits": null,
    "voltage": "220 V",
    "frequency": "60 Hz",
    "source": "dot_ph_bring",
    "last_verified": "2026-10-02"
  },
  "checklist": [
    {
      "id": "child_docs",
      "phase": "week",
      "icon": "family",
      "title_ko": "아이와 함께 가면 가족 서류 챙기기",
      "section": "entry",
      "text_ko": "15세 미만 자녀와 함께 가면 영문 가족관계증명서처럼 내 자녀임을 보여 주는 서류를 챙기세요."
    },
    {
      "id": "cash_declare",
      "phase": "three_days",
      "icon": "cash",
      "title_ko": "현금 신고 기준 알아 두기",
      "section": "payment",
      "text_ko": "5만 페소나 미화 1만 달러가 넘는 돈(현금·수표 등)을 가지고 들어가거나 나올 때는 필리핀 중앙은행(BSP)에 전체 금액을 신고해야 해요. 신고하지 않으면 넘는 돈을 빼앗기고 벌금을 낼 수 있어요."
    }
  ]
}
