{"schema_version":1,"country":"MY","version":"2026.10.03-2","last_verified":"2026-09-28","names":{"ko":"말레이시아","en":"Malaysia","local":"Malaysia"},"local_language":{"name_ko":"말레이어","tts_lang":"ms-MY"},"sources":[{"id":"mofa_my","name":"외교부 해외안전여행 · 말레이시아","url":"https://0404.go.kr/ntnSafetyInfo/56/detail"},{"id":"mdac_faq","name":"말레이시아 이민국 MDAC","url":"https://imigresen-online.imi.gov.my/mdac/main"},{"id":"embassy_my_lost","name":"주말레이시아 대한민국 대사관 · 여권 분실","url":"https://overseas.mofa.go.kr/my-ko/brd/m_1911/view.do?seq=1344692"},{"id":"grab_locations","name":"Grab 서비스 국가","url":"https://www.grab.com/sg/locations/"},{"id":"bolt_cities","name":"Bolt 서비스 도시","url":"https://bolt.eu/en/cities/"},{"id":"gmaps_play","name":"Google Play · Google 지도","url":"https://play.google.com/store/apps/details?id=com.google.android.apps.maps"},{"id":"st_plug","name":"말레이시아 에너지위원회 (플러그)","url":"https://www.st.gov.my/what-types-plug-tops-are-permitted-use-malaysia"},{"id":"tnb_system","name":"말레이시아 전력청 TNB (전압)","url":"https://www.mytnb.com.my/ms-MY/business/get-electricity/tnb-electricity-system"},{"id":"mytourism_shopping","name":"말레이시아관광청 · 쿠알라룸푸르 쇼핑","url":"https://ebrochures.malaysia.travel/en/kuala-lumpur/38-44-sensational-shopping/"},{"id":"customs_allowance","name":"관세청 여행자 휴대품 면세 범위","url":"https://customs.go.kr/kcs/cm/cntnts/cntntsView.do?mi=2837&cntntsId=829"},{"id":"mahb_klia1_ci","name":"Malaysia Airports · KLIA Terminal 1 Customs & Immigration","url":"https://www.malaysiaairports.com.my/en/klia1/air-travel/customs-and-immigration"},{"id":"mahb_klia2_ci","name":"Malaysia Airports · KLIA2 Customs & Immigration","url":"https://www.malaysiaairports.com.my/en/klia2/air-travel/customs-and-immigration"},{"id":"mahb_klia1_transfer","name":"Malaysia Airports · KLIA Terminal 1 Flight Transfer","url":"https://www.malaysiaairports.com.my/en/klia1/air-travel/flight-transfer"},{"id":"mahb_bki_ci","name":"Malaysia Airports · Kota Kinabalu Customs & Immigration","url":"https://www.malaysiaairports.com.my/en/bki/air-travel/customs-and-immigration"},{"id":"mahb_bki_transfer","name":"Malaysia Airports · Kota Kinabalu Flight Transfer","url":"https://www.malaysiaairports.com.my/en/bki/air-travel/flight-transfer"},{"id":"imi_mdac","name":"말레이시아 이민청 · MDAC 공식 사이트(등록 방법 인포그래픽)","url":"https://imigresen-online.imi.gov.my/mdac/main"},{"id":"imi_egate","name":"말레이시아 이민청 · MDAC Egate 이용 자격 확인(63개국)","url":"https://imigresen-online.imi.gov.my/mdac/egate"},{"id":"mofa_kk_mdac","name":"주코타키나발루 대한민국 분관 · MDAC 사칭·대행 사이트 주의","url":"https://overseas.mofa.go.kr/my-kk-ko/brd/m_27578/view.do?seq=13111"}],"requirements":[{"nationality":"KR","purpose":"tourism","visa":"not_required","stay_limit_days":90,"forms":["MY_MDAC"],"summary_ko":"대한민국 일반 여권은 비자 없이 90일까지 머물 수 있어요(두 나라 협정). 들어갈 때마다 도착 전에 말레이시아 입국 카드(MDAC)를 내야 해요.","source":"mofa_my","last_verified":"2026-09-28","passport_validity":{"months":6,"basis":"arrival","source":"mofa_my","last_verified":"2026-10-02"}}],"forms":[{"id":"MY_MDAC","name_ko":"말레이시아 입국 카드 (MDAC)","name_en":"Malaysia Digital Arrival Card","official_url":"https://imigresen-online.imi.gov.my/mdac/main","fee_ko":"공식 안내에 요금이 적혀 있지 않아요. 돈을 받는 대행 사이트는 쓰지 마세요.","window_ko":"도착 3일 전부터 낼 수 있어요(내는 날 포함). 방문할 때마다 내요.","window_days_including_arrival":3,"source":"mdac_faq","last_verified":"2026-09-28"}],"sections":[{"id":"entry","title_ko":"들어갈 때","body_ko":["비자 없이 90일까지 머물 수 있어요.","들어갈 때마다 공식 사이트에서 말레이시아 입국 카드(MDAC)를 내요. 일반 한국인 여행자는 빠지지 않아요.","미화 1만 달러어치가 넘는 현금은 세관(가방 속 물건을 확인하는 곳)에 신고해야 해요."],"source":"mdac_faq","last_verified":"2026-09-28"},{"id":"payment","title_ko":"돈","body_ko":["돈 단위는 링깃(Ringgit Malaysia, RM)이에요."],"source":"mofa_my","last_verified":"2026-09-28"},{"id":"safety","title_ko":"안전 (외교부 여행경보)","body_ko":["대부분 지역은 1단계(여행유의)예요.","사바주 동부해안은 2단계(여행자제), 사바주 동부 섬들과 동부해안 일부는 3단계(출국권고)예요.","여행경보는 자주 바뀌어요. 떠나기 전에 외교부 해외안전여행에서 다시 확인하세요."],"source":"mofa_my","last_verified":"2026-09-28"}],"transport_apps":[{"name":"Grab","package":"com.grabtaxi.passenger","link_type":"open_and_copy","source":"grab_locations"},{"name":"Bolt","package":"ee.mtakso.client","link_type":"open_and_copy","source":"bolt_cities"},{"name":"Google 지도","package":"com.google.android.apps.maps","link_type":"maps_url","source":"gmaps_play"}],"phrases":[{"id":"restroom","ko":"화장실이 어디예요?","en":"Where is the restroom?","local":"Di mana tandas?","reviewed":false},{"id":"lost","ko":"길을 잃었어요","en":"I'm lost.","local":"Saya sesat.","reviewed":false},{"id":"hospital","ko":"병원에 가야 해요","en":"I need to go to a hospital.","local":"Saya perlu pergi ke hospital.","reviewed":false},{"id":"slowly","ko":"천천히 말해 주세요","en":"Please speak slowly.","local":"Sila cakap perlahan-lahan.","reviewed":false},{"id":"address","ko":"이 주소로 가 주세요","en":"Please take me to this address.","local":"Tolong bawa saya ke alamat ini.","reviewed":false},{"id":"police","ko":"경찰을 불러 주세요","en":"Please call the police.","local":"Tolong panggil polis.","reviewed":false},{"id":"help","ko":"도와주세요","en":"Help me, please.","local":"Tolong!","reviewed":false}],"emergency":[{"id":"all","label_ko":"경찰·불·구급차","number":"999","source":"mofa_my","last_verified":"2026-09-28"},{"id":"kl_tourist_police","label_ko":"쿠알라룸푸르 관광경찰 신고","number":"+60-3-2163-4422","source":"mofa_my","last_verified":"2026-09-28"}],"embassy":{"name_ko":"주말레이시아 대한민국 대사관 (쿠알라룸푸르)","address":"No. 9 & 11, Jalan Nipah, Off Jalan Ampang, 55000 Kuala Lumpur, Malaysia","phone":"+60-3-4251-2336","emergency_phone":"+60-17-623-8343","source":"mofa_my","last_verified":"2026-09-28"},"procedures":[{"id":"passport_lost","title_ko":"여권을 잃어버렸어요","steps_ko":["경찰서에 분실 신고를 하고 신고서를 받아요.","대한민국 대사관에서 긴급여권을 신청해요(약 1시간, 미화 50달러어치 링깃). 경찰 신고서, 분실 사유서, 사진 1장을 챙겨요.","짧게 머무는 여행자는 푸트라자야 이민국에서 특별 허가(Special Pass)를 받아야 나갈 수 있어요(RM100, 주말 쉼)."],"source":"embassy_my_lost","last_verified":"2026-09-28"}],"shopping":[{"id":"batik","category":"souvenir","names":{"ko":"바틱 천·옷","en":"Batik","local":"Batik"},"why_ko":"관광청이 사롱·셔츠·원피스 등 바틱 제품을 대표 쇼핑으로 소개해요.","import_status":"allowed","import_note_ko":"면세 한도(미화 800달러) 안이면 세금 없이 가져올 수 있어요.","source":"mytourism_shopping","import_source":"customs_allowance","last_verified":"2026-09-29"},{"id":"songket","category":"souvenir","names":{"ko":"송켓 직물","en":"Songket","local":"Songket"},"why_ko":"금실·은실로 짠 전통 직물이에요. 관광청 쇼핑 안내에 나와요.","import_status":"allowed","import_note_ko":"면세 한도(미화 800달러) 안이면 세금 없이 가져올 수 있어요.","source":"mytourism_shopping","import_source":"customs_allowance","last_verified":"2026-09-29"},{"id":"pewter","category":"souvenir","names":{"ko":"주석 공예품","en":"Pewterware","local":"Barangan piuter"},"why_ko":"찻잔 세트·액자·꽃병 같은 주석 제품이에요. 관광청 쇼핑 안내에 나와요.","import_status":"allowed","import_note_ko":"면세 한도(미화 800달러) 안이면 세금 없이 가져올 수 있어요.","source":"mytourism_shopping","import_source":"customs_allowance","last_verified":"2026-09-29"}],"power":{"plug_ko":"납작한 핀 3개(13A, 영국식)","kr_plug_fits":false,"voltage":"230 V","frequency":"50 Hz","source":"tnb_system","last_verified":"2026-09-29"},"airports":[{"code":"KUL","name_ko":"쿠알라룸푸르 국제공항 (KLIA 제1·제2터미널)","name_en":"Kuala Lumpur International Airport (KLIA Terminal 1 & Terminal 2)","city_ko":"쿠알라룸푸르","egate_kr":true,"egate_note_ko":"말레이시아 이민청 MDAC 사이트의 자동 게이트(egate) 이용 가능 63개국에 한국(Republic of Korea)이 들어 있어요. 전자여권이 있어야 하고, MDAC를 미리 내야 해요.","form_check_ko":"미리 낸 MDAC 등록 내용을 입국 심사대에서 보여 줘요.","steps":[{"kind":"immigration","title_ko":"입국 심사","body_ko":"입국 심사대에서 여권을 확인받아요.","where_ko":null,"source":"imi_mdac"},{"kind":"egate","title_ko":"자동 게이트","body_ko":"조건에 맞으면 직원이 있는 카운터 대신 자동 게이트로 지나갈 수 있어요.","where_ko":null,"source":"imi_egate"},{"kind":"baggage","title_ko":"짐 찾기","body_ko":"입국 심사를 지나 짐을 찾아요.","where_ko":null,"source":"mahb_klia1_transfer"},{"kind":"customs","title_ko":"세관 (가방 속 물건 확인)","body_ko":"세금을 내야 하는 물건이나 금지 물품은 모두 신고해요. 세관 직원이 가방을 열어 보자고 할 수 있어요.","where_ko":null}],"map_url":"https://www.malaysiaairports.com.my/en/klia1/map","source":"mahb_klia1_ci","last_verified":"2026-10-03","form_check_source":"imi_mdac"},{"code":"BKI","name_ko":"코타키나발루 국제공항","name_en":"Kota Kinabalu International Airport","city_ko":"코타키나발루","egate_kr":null,"egate_note_ko":null,"form_check_ko":"미리 낸 MDAC 등록 내용을 입국 심사대에서 보여 줘요.","steps":[{"kind":"immigration","title_ko":"입국 심사","body_ko":"입국 심사대에서 여권을 확인받아요.","where_ko":null,"source":"imi_mdac"},{"kind":"baggage","title_ko":"짐 찾기","body_ko":"입국 심사를 지나 짐을 찾아요.","where_ko":null,"source":"mahb_bki_transfer"},{"kind":"customs","title_ko":"세관 (가방 속 물건 확인)","body_ko":"세금을 내야 하는 물건이나 금지 물품은 모두 신고해요. 세관 직원이 가방을 열어 보자고 할 수 있어요.","where_ko":null}],"map_url":"https://www.malaysiaairports.com.my/en/bki/air-travel/customs-and-immigration","source":"mahb_bki_ci","last_verified":"2026-10-03","form_check_source":"imi_mdac"}],"checklist":[{"id":"cash_declare","phase":"three_days","stage":"docs","icon":"cash","title_ko":"현금 신고 기준 알아 두기","section":"entry","text_ko":"미화 1만 달러어치가 넘는 현금은 세관(가방 속 물건을 확인하는 곳)에 신고해야 해요."}]}